{
  "schema_version": "1.0",
  "generated_at": "2026-10-27T00:00:00+00:00",
  "pipeline_run": {
    "run_id": "fixture-1",
    "mode": "manual",
    "model": null,
    "prompt_version": null,
    "started_at": "2026-10-27T00:00:00+00:00",
    "finished_at": "2026-10-27T00:00:00+00:00",
    "duration_seconds": 0,
    "source_document_ids": ["test-source"],
    "usage": null
  },
  "disease": { "id": "test", "name": "Test disease (fixture, not clinical content)" },
  "sources": [
    { "id": "test-source", "title": "Test source document", "file": null, "url": null, "media_type": null, "credit": null }
  ],
  "topics": [
    {
      "id": "test-topic",
      "name": "Test topic",
      "order": 1,
      "icon": null,
      "description": "Fixture used by backend and frontend tests. Not shown to patients.",
      "subtopics": [
        { "id": "test-subtopic", "name": "Test subtopic", "order": 1, "lesson_ids": ["test-lesson-checked", "test-lesson-draft"] }
      ]
    }
  ],
  "lessons": [
    {
      "id": "test-lesson-checked",
      "version": 1,
      "topic_id": "test-topic",
      "subtopic_id": "test-subtopic",
      "order": 1,
      "title": "Checked test lesson",
      "summary": "This lesson passed every automatic check.",
      "est_minutes": 1,
      "body_markdown": "This is placeholder text for testing.\n\n- It has a bullet.\n- And **bold** text.",
      "key_takeaways": ["Placeholder takeaway."],
      "images": [],
      "source_refs": [{ "source_id": "test-source", "pages": [1], "excerpt": null }],
      "status": "checked",
      "origin": "human_authored",
      "claims": [{ "text": "Placeholder claim.", "source_id": "test-source", "page": 1, "supported": true }],
      "checks": [{ "name": "claims_supported", "passed": true, "detail": null }],
      "quiz": [{ "id": "test-lesson-checked-q1", "question": "Is this a test?", "options": ["Yes", "No"], "answer": 0, "feedback": "It is.", "source_id": "test-source" }]
    },
    {
      "id": "test-lesson-draft",
      "version": 1,
      "topic_id": "test-topic",
      "subtopic_id": "test-subtopic",
      "order": 2,
      "title": "Draft test lesson",
      "summary": "This lesson failed an automatic check and must never reach patients.",
      "est_minutes": 1,
      "body_markdown": "SECRET-DRAFT-MARKER: if you can read this through the anon key, access control is broken.",
      "key_takeaways": [],
      "images": [],
      "source_refs": [{ "source_id": "test-source", "pages": [1], "excerpt": null }],
      "status": "draft",
      "origin": "ai_generated",
      "claims": [{ "text": "Unsupported placeholder claim.", "source_id": "test-source", "page": 1, "supported": false }],
      "checks": [{ "name": "claims_supported", "passed": false, "detail": "1 unsupported claim" }],
      "quiz": []
    }
  ]
}
